id,name,formula,unit,description,levels
76,Vesiniksulfiid,H<sub>2</sub>S,ug/m3,"Vesiniksulfiid on ebameeldiva lõhnaga (mädamuna lõhnaga) gaas, mis tekib bioloogilise materjali anaeroobsel käärimisel (veepuhastusjaamad, põllumajandus jne). Vesiniksulfiidi eraldub välisõhku ka mitmete naftaproduktide (eelkõige raske kütteõli) ja põlevkiviõli laadimisel ja soojendamisel. Välisõhus esinevad tasemed on enamasti madalamad ebasoodsat tervisemõju põhjustavatest tasemetest kuid tingituna ebameeldivast lõhnast mõjub häirivalt. Välisõhus on vesiniksulfiidi maksimaalne lubatud kontsentratsioon 8 µg/m³.","[{'id': 5, 'code': 'LEVEL_5', 'name': 'Väga halb', 'description': None, 'color': '#f13838', 'count': None, 'limit': 75}, {'id': 4, 'code': 'LEVEL_4', 'name': 'Halb', 'description': None, 'color': '#e2791b', 'count': None, 'limit': 50}, {'id': 3, 'code': 'LEVEL_3', 'name': 'Keskmine', 'description': None, 'color': '#efef33', 'count': None, 'limit': 25}, {'id': 2, 'code': 'LEVEL_2', 'name': 'Hea', 'description': None, 'color': '#80c75e', 'count': None, 'limit': 15}, {'id': 1, 'code': 'LEVEL_1', 'name': 'Väga hea', 'description': None, 'color': '#3ab734', 'count': None, 'limit': 0}]"
77,Peened osakesed,PM10,µg/m3,"Tahked ja vedelad osakesed aerodünaamilise diameetriga alla 10 mikromeetri (0,00001 meetrit). Satuvad välisõhku teekattelt, põlemisprotsessidest jne. Sõltuvat tekkeprotsessist on väga erineva keemilise koostisega ja mitmesuguse mõjuga inimeste tervisele. Linnaõhus sisalduvad peened osakesed pärinevad liiklusest, teekattelt, koduahjudest ja paljudest muudest allikatest. Linnaõhus on suurusjärgus 5-10 µg/m³ peeneid osakesi pärit väljastpoolt linna asuvaid saasteallikaid. Peente osakeste lubatud ööpäevakeskmine sisaldus on 50 µg/m³ ja aastakeskmine sisaldus on 40 µg/m³.","[{'id': 5, 'code': 'LEVEL_5', 'name': 'Väga halb', 'description': None, 'color': '#f13838', 'count': None, 'limit': 1000}, {'id': 4, 'code': 'LEVEL_4', 'name': 'Halb', 'description': None, 'color': '#e2791b', 'count': None, 'limit': 500}, {'id': 3, 'code': 'LEVEL_3', 'name': 'Keskmine', 'description': None, 'color': '#efef33', 'count': None, 'limit': 250}, {'id': 2, 'code': 'LEVEL_2', 'name': 'Hea', 'description': None, 'color': '#80c75e', 'count': None, 'limit': 100}, {'id': 1, 'code': 'LEVEL_1', 'name': 'Väga hea', 'description': None, 'color': '#3ab734', 'count': None, 'limit': 0}]"
78,Eriti peened osakesed,PM25,µg/m3,"Tahked ja vedelad osakesed aerodünaamilise diameetriga alla 2,5 mikromeetri (0,0000025 meetrit). Satuvad välisõhku peamiselt põlemisprotsessidest, samuti tekivad atmosfääris fotokeemilistel reaktsioonidel jne. Sõltuvat tekkeprotsessist on väga erineva keemilise koostisega ja mitmesuguse mõjuga inimeste tervisele. Linnaõhus sisalduvad eriti peened osakesed pärinevad liiklusest,  koduahjudest ja paljudest muudest allikatest.  Eriti peente osakeste lubatud aastakeskmine sisaldus on 25 µg/m³.","[{'id': 5, 'code': 'LEVEL_5', 'name': 'Väga halb', 'description': None, 'color': '#f13838', 'count': None, 'limit': 300}, {'id': 4, 'code': 'LEVEL_4', 'name': 'Halb', 'description': None, 'color': '#e2791b', 'count': None, 'limit': 150}, {'id': 3, 'code': 'LEVEL_3', 'name': 'Keskmine', 'description': None, 'color': '#efef33', 'count': None, 'limit': 75}, {'id': 2, 'code': 'LEVEL_2', 'name': 'Hea', 'description': None, 'color': '#80c75e', 'count': None, 'limit': 50}, {'id': 1, 'code': 'LEVEL_1', 'name': 'Väga hea', 'description': None, 'color': '#3ab734', 'count': None, 'limit': 0}]"
79,Must süsinik,BC,ug/m3,,"[{'id': 5, 'code': 'LEVEL_5', 'name': 'Väga halb', 'description': None, 'color': '#f13838', 'count': None, 'limit': 12}, {'id': 4, 'code': 'LEVEL_4', 'name': 'Halb', 'description': None, 'color': '#e2791b', 'count': None, 'limit': 7}, {'id': 3, 'code': 'LEVEL_3', 'name': 'Keskmine', 'description': None, 'color': '#efef33', 'count': None, 'limit': 3}, {'id': 2, 'code': 'LEVEL_2', 'name': 'Hea', 'description': None, 'color': '#80c75e', 'count': None, 'limit': 1}, {'id': 1, 'code': 'LEVEL_1', 'name': 'Väga hea', 'description': None, 'color': '#3ab734', 'count': None, 'limit': 0}]"
81,UV-A kiirgus,UV-A,W/m2,<p>L&auml;hi UV kiirgus lainepikkusega&nbsp;380&ndash;315&nbsp;nm</p>,
82,UV-B kiirgus,UV-B,W/m2,<p>Kesk UV kiirgus lainepikkusega&nbsp;315&ndash;280&nbsp;nm</p>,
